transcription,reference,wer,rtf,cpu
 barn placerasers in foster home of monguili from vanvoorn to overgrep and toil with outpressing ,barn placeras i fosterhem av många olika anledningar från vanvård till övergrepp och till med utpressning,0.9375,1.0093867539401993,787.4
 even if this often only a felaidey stereotype it s the best way to clear to see paris forfear and to be upforse to behave as someone who is bien eleve well uphustrusted it will to do it better than easier to take to their round , även om detta ofta bara är en felaktig stereotyp är det bästa sättet att klara sig i paris fortfarande att uppföra sig på bästa sätt och bete sig som någon som är bien élevé väluppfostrad det kommer göra det betydligt enklare att ta sig runt ,1.0,0.8775322146676667,778.9
 oliver sachs to their scrift president s tal how people who can t understand tal on the ground of their scarador though can bedumour to thu can bedum upricticity correct , oliver sacks visade i sin skrift presidentens tal hur människor som inte kan förstå tal på grund av hjärnskador ändå kan bedöma uppriktighet korrekt ,1.125,1.1033482222444682,777.4
 it heavdas of the best placering the subject are the liners that deli thriller vertical and horizontally mots see example ,det hävdas att den bästa placeringen för subjektet är där linjerna som delar bilden i tredjedelar vertikalt och horisontellt möts se exemplet,1.0,0.9441398982460618,786.9
 meanwhile he had been arbetted the shirkens undershooker for their today s fideslars under their free time ,medan han arbetade på sjukhuset började liggins undersöka för tidiga födslar under sin fritid,1.1428571428571428,1.4314894285579185,789.3
 this does that it is backhot compatible with 802 11a 802 11b and 8002 11g foresat that bas station has two radio apparatus ,detta gör att den är bakåtkompatibel med 802 11a 802 11b och 802 11g förutsatt att basstationen har två radioapparater,0.9,0.5655838267380267,780.1
 stora the the o ro are muckeletes befolk are my gleeced befolcated and this are nearer nobboot wild mark ,stora områden längre norrut är mycket glest befolkade och vissa är nära nog obebodd vildmark,1.2,1.0675455248633097,786.1
 he did not take the medicine as thou to overvina their smertad and it is forbidden in the tevlainen ,han har inte kunnat ta de mediciner som behövs för att övervinna sin smärta då de är förbjudna i tävlingen,1.0,1.777663358352469,780.2
 shelve fordoonet tooks boartflexen and the clock 1 00s samma day ,själva fordonet togs bort från olycksplatsen runt klockan 12 00 samma dag,0.9166666666666666,1.0669498830228237,790.2
 sammonad thear the another traffic flykliplan of a landingsbane in mashad and collided with a wegg which led to 17 today ,samma månad körde en annat trafikflygplan av en landningsbana i mashhad och kolliderade med en vägg vilket ledde till 17 döda,0.9523809523809523,0.9600872926190627,788.0
 legeringeringer is a blending of two or flera metals come to the today that there are many different themine in the periodic system ,legeringar är en blandning av två eller flera metaller kom ihåg att det finns många olika grundämnen i det periodiska systemet,1.0476190476190477,1.0006415140297678,777.3
 for springboks it ended in a 5 matchelong forlust series ,för springboks avslutade det en fem matcher lång förlustserie,1.0,1.613302445143796,790.3
 it will be naturally easier for that to learn the portuguese if you already can a romansk sproak ,det blir naturligtvis enklare för dig att lära dig portugisiska om du redan kan ett romanskt språk,1.0588235294117647,1.1344869342851052,788.7
