transcription,reference,wer,rtf,cpu
 monasyutae outaute mone s utterlager moanusytrue lager call scorpan ,månens yta utgörs av stenar och stoft månens yttre lager kallas skorpan,0.9166666666666666,2.514419456322988,718.5
 many tisca backwerk have also mandlar hassel nutter and other nutter popular caccor passar often especially good with a cop starked coffee ,många tyska bakverk har också mandlar hasselnötter och andra nötter populära kakor passar ofta särskilt bra med en kopp starkt kaffe,0.9523809523809523,0.817816264939047,785.4
 enlied gouverneurshtaben was 19 of the scadded police ,enligt guvernörsstaben var nitton av de skadade poliser,1.0,1.1225608523917083,786.5
 buses are avgoer from the district s emensensan bus station over flooden their the day with the most especially them who are on the way the easter and jackar boom tang go between half seven and half eighth ,bussar avgår från den distriktsgemensamma busstationen över floden hela dagen men de flesta särskilt de som är på väg mot öster och jakar bumthang går mellan 6 30 och 7 30,1.2258064516129032,0.711150951486416,773.5
 australia s mitchell golly sluited as 11 in herrna s day in the super g the czechska concurrent aldrich jelinek sluited as number 16 in hererna s super g ,australiens mitchell gourley slutade som elva i herrarnas stående super g den tjeckiska konkurrenten oldrich jelinek slutade som nummer sexton i herrarnas super g,0.9583333333333334,0.7242884949175981,780.1
 vandaliser the the placer thear the plaid or scap graffiti on structures ,vandalisera inte platsen genom att måla eller skrapa graffiti på strukturer,1.0,1.1079631116655138,787.7
 the other nominerings include best film rechisher film costeim design film redicering original music production design jud redicering jud mixing original manus ,de andra nomineringarna inkluderar bästa film regissör filmkonst kostymdesign filmredigering originalmusik produktionsdesign ljudredigering ljudmixning och originalmanus,1.3125,0.9934121895136323,777.3
 in norr visit also fantastixa s sanctuary of our lady of fatima helgedom a plaughts wers beaumbun for upunbarers of maria ,i norr besök också fantastiska sanctuary of our lady of fatima helgedom en plats världsberömd för uppenbarelser av maria,0.631578947368421,1.0314203020352035,780.9
 therefore blueerspennan an true fuelge sluggler for many menaichur when it came out ,därför var blyertspennan en trogen följeslagare för många människor när den kom ut,1.0,1.3448064836362998,779.0
 giancarlo fischiella lost the control of their car and the loppe at the start ,giancarlo fisichella förlorade kontrollen över sin bil och avslutade loppet strax efter starten,1.0,1.4694650967915852,740.7
 resonare recommended stark to be aware of risk their hard value their area because it can affect their areas planner ,resenärer rekommenderas starkt att vara medvetna om risken för hårt väder som påverkar deras område eftersom det kan påverka resplanerna,1.0,1.1013253346114258,780.6
 he said that netsharinger would base to china s economic stirca and gave them no griffro for them ,han sa att nedskärningarna skulle baseras på kinas ekonomiska styrka och gav inte några siffror för dem,1.0588235294117647,1.285808463381906,748.5
 enid governor s tabin was 19 of the scalded police ,enligt guvernörsstaben var nitton av de skadade poliser,1.25,1.0826374021705223,784.1
 but with their placering in the high tropiqaica just a few grader norome equator must you hater both heta altid and stark sol when the thin is clear more seldom , men med sin placering i höga tropikerna bara några få grader norr om ekvatorn måste du hantera både hetta alltid och stark sol när himlen är klar mer sällan ,0.9310344827586207,0.7388886970907209,775.8
 the american engineer s corps them reign should be the today or scalded the for damning to brist ,den amerikanska ingenjörskåren bedömde att 6 tums regn skulle kunna få de tidigare skadade fördämningarna att brista,1.0588235294117647,1.2598720200160414,786.5
 this sediment was necessary for to create sand drevostendum which functioned as natural milure for their lives ,detta sediment var nödvändigt för att skapa sandrev och stränder som fungerade som naturliga miljöer för djurliv,0.9411764705882353,1.283290113011996,781.6
 fersionz bomber grundunded to the principle that krafz enerci for to actaccombe a cairnum with many protons and ectrones ,fissionsbomben grundar sig på principen att det krävs energi för att åstadkomma en kärna med många protoner och neutroner,1.0,1.6424061871376359,782.6
 brancoren sleighted so smootenimelden we 2335 to 5 o clock ,brandkåren släckte så småningom elden vid 23 35 på kvällen,1.0,1.6804322861788565,782.8
 usa gymnastics and usock have same goal to do gymnastics and other sports so sacrata as possible so that the throtter should follow their drums in a try positive and strking milieu ,usa gymnastics och usoc har samma mål att göra gymnastiken och andra sporter så säkra som möjligt så att idrottare ska kunna följa sina drömmar i en trygg positiv och stärkande miljö,0.9375,0.811690163555191,777.2
 all dealtors in the samm in principle all clagre over a transport system in principle all claguer over a transport system ,alla deltar i samhället och använder transportsystem i princip alla klagar över transportsystem,1.6153846153846154,1.7401814460754392,786.0
 a bomb exploded out of the general governor s contor ,en bomb exploderade utanför generalguvernörens kontor,1.5,2.0681884205132204,781.2
 even if al is stark fripped with science fiction it is a much important gren in the data wetonskapen that inbegripe machine s beaen inlearning and intelligence ,även om ai är starkt förknippat med science fiction är det en mycket viktig gren inom datavetenskapen som inbegriper maskiners beteende inlärning och intelligens,1.0,0.8867924719785166,782.2
 hammna was scodeplatts for an unkent deadlager in 1889 when 7 shep from tysklan usa stur britan wagered to lemna the hamne ,hamnen var skådeplats för ett ökänt dödläge år 1889 när sju skepp från tyskland usa och storbritannien vägrade lämna hamnen,1.0,1.308279754194014,772.5
 the first of these 78 recommendations are a new diplomatic initiative be tasuar in the end of this year for to sake iraq s granse against fientlient interventions and to re establish diplomatic relations with these granners ,den första av dess 78 rekommendationer är att ett nytt diplomatiskt initiativ bör tas innan slutet av det här året för att säkra iraks gränser mot fientliga interventioner och att återetablera diplomatiska relationer med dess grannar,1.0,0.8659824709333136,778.8
 popular sports include football basketball volleyball water polo fecting rugby cycle ice hockey ice hockey ruralskinsk hocki and formell 1 ,populära sporter inkluderar fotboll basket volleyboll vattenpolo fäktning rugby cykel ishockey rullskridskohockey och formel 1,1.2,0.7312450750890481,780.9
 with kundalini yoga kundaline energy uplisning energy through yoga stelignings tellines mantra mantra and visualiserings ,med kundaliniyoga väcks kundalini energin upplysningsenergi genom yogaställningar andningsövningar mantran och visualiseringar,1.25,0.8297092924813856,782.5
 professor pamela ferguson at dundee s university constated that journalists will their fauli if they publishes pictures etc of mistanta , professor pamela ferguson vid dundees universitet konstaterar att journalister väljer en farlig linje om de publicerar bilder etc av misstänkta ,0.8,0.9702982505162556,786.0
 several thea scharmes installed to different places in room for that the folk could see ceremonine ,flera stora tv skärmar installerades på olika platser i rom för att folket skulle kunna se ceremonin,1.0,1.6075166358131152,782.8
 for example so is the most format for stillbilder in the world 35mm which was the domineranded film s tool the dominant film s tool the end of the analogue film s era ,till exempel så är det vanligaste formatet för stillbilder i världen 35 mm vilket var den dominerande filmstorleken vid slutet av den analoga filmens era,1.24,0.8934415250584699,780.4
 moselut the today west europe developed their own style one of the times thea st thea s thearst the was that folk started to use knappes for tofest a cladder ,mot slutet av medeltiden började västeuropa utveckla sin egen stil en av tidens största utvecklingar till följd av korstågen var att folk började använda knappar för att fästa kläder,1.0,1.0474781807998905,773.5
 the flifest buygn en over the complex outcant buyxombexom for to give the touris an better idea about how it was original ,de flesta byggnaderna vid komplexets utkant har byggts om för att ge turister en bättre idé om hur de såg ut i original,0.9565217391304348,1.27367847137623,784.0
 scenerner vises on pyramid and the the olykairmines will be uplysed ,scenerna visas på pyramiderna och de olika pyramiderna blir upplysta,1.1,1.172564495568988,784.5
 out over on the today s evenement carpanedo in two individual lopfiedmesthapet ,utöver onsdagens evenemang tävlade carpanedo i två individuella lopp vid mästerskapet,1.0909090909090908,1.087328212636624,785.4
 gisza platon or gisa necropolis in the egyptian diodanstal inole flierer pyramide where of the the thorough pyramids are the their thea theory of their thel and the sphinx , gizaplatån eller giza necropolis i den egyptiska dödens dal innehåller flera pyramider varav den stora pyramiden är den största flera mindre gravmonument flera tempel och den stora sfinxen ,1.0,1.1261535866912704,774.2
 when all come in around we don t be fervonant over our their their own forefad lest their protein problem on the thus as the chimpanzee on the savann did today , när allt kommer omkring bör vi inte bli förvånade om våra egna förfäder löste sitt proteinproblem på ungefär samma sätt som chimpanser på savannen gör i dag ,1.1481481481481481,1.3651705036560695,777.7
 pyramiders lus and juice show is one of the most interesting things for the their the the the most interesting things for the their the the the,pyramidernas ljud och ljusshow är en av de mest intressanta sakerna för barn på området,1.8,1.0513725151886812,782.6
 lemplivening of blogger can give the their eveler the possibility to be more analytic and critical geneumat s material can their definiar their positions in relation to what other have scrivet and ready to do for their owne for their own perspective on specific questions this year of week 202 , lämplig användning av bloggar kan ge eleverna möjlighet att bli mer analytiska och kritiska genom att aktivt svara på internetmaterial kan eleverna definiera sina positioner i relation till vad andra har skrivit samt redogöra för sina egna perspektiv på specifika frågor oravec 2002 ,1.1627906976744187,0.7741772436931539,776.8
 fruchner to telkina gave his intention to candidate to president on the argentinian theater same place where she started their campaign to senate year 2005 as a meadlem in providz delegation from buenos aires ,fru kirchner tillkännagav sin intention att kandidera till president på den argentinska teatern samma plats där hon startade sin kampanj till senaten år 2005 som medlem i provinsdelegationen från buenos aires,0.9354838709677419,0.7243082811843314,773.8
 enlorskirbunter the university two ferninger kristallus they can blocker nure function when it reacts with varandra ,enligt forskare vid universitetet bildar de två föreningarna kristaller som kan blockera njurfunktionen när de reagerar med varandra,0.9444444444444444,1.4038729329481192,779.4
 end mutations in short planting cellars can neaervas to the barn while mutation on other places can cause cell dead or cancer ,endast mutationer i fortplantningsceller kan nedärvas till barn medan mutationer på andra ställen kan orsaka cell död eller cancer,1.0,1.4531694925748386,784.4
 he told it that they though not today today today today should be today shildighities that go bottom their out of the development nove their their development nivore , han tillade att de dock inte borde förväntas att ta på sig skyldigheter som går bortom deras utvecklingsnivå ansvar och förmågor ,1.3333333333333333,1.244392926076491,767.8
 sundarbans have ant s has ta untauggeds versailles world s list the the of the scooges that lids territory called sundarbans national park ,sundarbans har antagits på unescos världsarvslista den del av skogen som ligger på indiskt territorium kallas sundarbans national park,1.0,1.0143753419927999,780.8
 it attacked also everything that came down in the water even a gigantic dinosaur as tijex was no match for it ,den attackerade också allting som kom ner i vattnet även en gigantisk dinosaurie som t rex var ingen match för den,0.9523809523809523,1.2815127697594264,760.7
 endo take myriates s throat lyd all the shilter and were much upmerexan on security s warninger ,ändå ta myndigheternas råd lyd alla skyltar och var mycket uppmärksam på säkerhetsvarningar,1.2307692307692308,2.0852330047335825,767.4
 traffic flood is the study their individual furor and foeulun ruly roes in between two points how it interacts with one other ,trafikflöde är studiet av hur individuella förare och fordon rör sig mellan två punkter och hur de interagerar med varandra,1.1,1.5708660445927423,768.0
 even if this often only is a felaic stereotype it is the best set that to clarate to parise in paris still to upfara to the best way and beaute to beaune eleve well up fostered it will do it betii truly to take to their took , även om detta ofta bara är en felaktig stereotyp är det bästa sättet att klara sig i paris fortfarande att uppföra sig på bästa sätt och bete sig som någon som är bien élevé väluppfostrad det kommer göra det betydligt enklare att ta sig runt ,1.0444444444444445,0.8776481679784573,766.4
 he said that nedscherninger would base to china s economic stirca and gave me no their sifres for them ,han sa att nedskärningarna skulle baseras på kinas ekonomiska styrka och gav inte några siffror för dem,1.1176470588235294,1.2738359325072344,783.1
 some menaces thought that he had the right but monguad the mothsauad sysystems that the solar system rowered to the world including the sun and also the other stars ,vissa människor trodde att han hade rätt men många trodde motsatsen att solsystemet rörde sig runt jorden inklusive solen och också de andra stjärnorna,1.2083333333333333,1.28080838067191,776.1
 barcelona s official sproch is catalanca and spanish about half theirfredrard to tala catalanca an over vailing majority forstordee and so good as all can spanish ,barcelonas officiella språk är katalanska och spanska ungefär hälften föredrar att tala katalanska en överväldigande majoritet förstår det och så gott som alla kan spanska,1.0,0.6409273750480564,757.5
 analyser the plaits genu or scrap graffiti on structures ,vandalisera inte platsen genom att måla eller skrapa graffiti på strukturer,0.9090909090909091,1.8974465131759644,785.8
 traffic fle is the study of how individual foerer and fordoon to thrown to two points and how they interact with their other ,trafikflöde är studiet av hur individuella förare och fordon rör sig mellan två punkter och hur de interagerar med varandra,1.15,1.183204007048144,785.0
 the official falklands valutan falclands p v k p where s their motsvare the value is the british pund g b p ,den officiella falklands valutan är falklandspundet fkp vars värde motsvarar värdet för ett brittiskt pund gbp,1.1875,1.3045058843675355,774.5
 jeter verker have domestized first for about 10 000 years then in zagrosbergen in iran ,getter verkar ha domesticerats först för omkring 10 000 år sedan i zagrosbergen i iran,0.7333333333333333,1.217478537092022,709.3
 romantician inaultermines with urspumo s forefattor fischte and schlegel ,romantiken innehöll ett stort element av determinism med ursprung hos författare som goethe fichte och schlegel,0.9375,1.3122437411729888,767.6
 as a result two fish carter outrouted two other outrottings hoted including the heart an humpback chub gila sypha ,som ett resultat har två fiskarter utrotats och två andra är utrotningshotade inklusive arten humpback chub gila cypha,0.8888888888888888,1.3517368371319618,760.2
 aristotle seine for other vetenscapes and frogs including psychology accepted this ,aristoteles syn på alla vetenskapliga frågor inklusive psykologi accepterades,1.2222222222222223,0.9997321905192333,788.7
 you can also have a tonskemole on to consult other regi regirringer than your own but their rod is outformed for their own invonarer ,du kan också ha önskemål om att konsultera andra regeringar än din egen men deras råd är utformade för sina egna invånare,1.0909090909090908,1.0628878550171643,784.6
 more traditional chircurur hold often an posknats messes on lodak s twell under post heljnighen wydmidnaz bryt then theirshamling up for to fi a christi upstonnelse ,mer traditionella kyrkor håller ofta en påsknattsmässa på lördagskvällen under påskhelgen vid midnatt bryter sedan församlingen upp för att fira kristi uppståndelse,1.1363636363636365,0.8796572846117934,780.7
 one can only under what it will be of tangentboard when a nouget come ,man kan bara undra vad det blir av tangentbordet när något nyare kommer,1.0769230769230769,1.3372377651493723,781.0
 flera stora tv shermer installed to o clock in rome for that the people could see ceremonine ,flera stora tv skärmar installerades på olika platser i rom för att folket skulle kunna se ceremonin,0.8235294117647058,1.1434036521284794,787.2
 flotter s job has traditionally been to sakestell their land uprotholer their formogne to forflut and same thear the fien s fomo formo to flyta a folk and goods ,flottornas jobb har traditionellt varit att säkerställa att ditt land upprätthåller förmågan att förflytta ert folk och gods och samtidigt störa fiendens förmåga att förflytta folk och gods,0.9642857142857143,1.0390663278332755,779.7
 plitwice soeuvres national park is bewuxen with tet scog hewutsakling with book gran and edergran and have a blanding of alp and meddle havs vegetation ,plitvicesjöarnas nationalpark är bevuxen med tät skog huvudsaklingen med bok gran och ädelgran och har en blandning av alp och medelhavsvegetation,1.0952380952380953,0.8380638228522407,783.7
 termen safari is popularly bruires over land for to see the fantastic african wild duren especially on savannum ,termen safari i populärt bruk avser resor över landet för att se de fantastiska afrikanska vilda djuren särskilt på savannen,0.9,1.0167912496783869,772.1
 sedana suncheon grunded 1537 and have paraguay had paraguay managed to hold much of their inhem s character of identity ,sedan asunción grundades 1537 har paraguay lyckats behålla mycket av sin inhemska karaktär och identitet,1.2,1.1465984492000671,782.0
 in nore visit also fantastic sanctuary of our lady of fatima helgidum a place world s beruum for openbarians of maria ,i norr besök också fantastiska sanctuary of our lady of fatima helgedom en plats världsberömd för uppenbarelser av maria,0.7368421052631579,1.042357330802102,787.9
 scenerner visas on pyramid and the different pyramidermids be uplysed ,scenerna visas på pyramiderna och de olika pyramiderna blir upplysta,0.9,1.3554157997045866,773.1
 samoa s hivutstadt is aspia appia the city ligue l opolo and has a folkmonged strax under 40 000 ,samoas huvudstad heter apia staden ligger på ön upolu och har en folkmängd strax under 40 000,0.8823529411764706,0.7327349877905571,788.8
 the other nominerings include best film regiscier film coonst costume design film redigering original music production design thud reedigering yudmixing and original manus ,de andra nomineringarna inkluderar bästa film regissör filmkonst kostymdesign filmredigering originalmusik produktionsdesign ljudredigering ljudmixning och originalmanus,1.375,0.6885053640530433,785.9
 generally set can two beauteen in frontrad when their tiefer be led to their ti liquer in the one end of spectrum their tryfers forby any ganget , generellt sett kan två beteenden framträda när chefer börjar leda sina tidigare gelikar i den ena änden av spektrumet försöker chefen att förbli en i gänget ,1.0384615384615385,1.0934545880272275,782.3
 goma is thumbly sake but should they have a visit outside of goma should they try to look at the stridicethities in north kiviv province ,goma är tämligen säkert men ska man avlägga visit utanför goma bör man undersöka hur det ser ut med stridigheterna i norra kivu provinsen,0.9583333333333334,0.9584595125617711,780.8
 there is self claught geological forclerogicality to this tradition but it can much well handle on it for christen s voir and fertility s ritual ,det finns självklart kristna teologiska förklaringar till denna tradition men det kan mycket väl handla om en förkristen vår och fertilitetsritual,1.1428571428571428,1.2554995584906194,780.8
 when all tie earneligli resources are ambefti in an organization s functional a avdellinger can creativity and upfigmigrign s rickedom frauds ,när alla tillgängliga resurser används effektivt i en organisations funktionella avdelningar kan kreativitet och uppfinningsrikedom frodas,1.3125,0.9165379206339518,784.0
 tiger s wrytanden s lyrnets yulean s yurliger than more so the meaning of morrrand screaming word ,tigerns rytande är inte som lejonets ljudliga rytande utan mer som en mening av morrande skrikande ord,1.0,1.4654694818982892,787.6
 thele 20 of wattnes are in the have from jordan s flode it comes from amazonas ,hela 20 procent av vattnet som rinner ut i haven från jordens floder kommer från amazonas,0.875,1.5393470204065718,789.7
 daniel l tagnan tagne f an expert on the suckeptu said that the outprotects sacked us of the freedom s bevaranda stircour their trucerns ,danielle lantagne fn expert på sjukdomen sade att utbrottet sannolikt orsakades av de fredsbevarande styrkorna,1.5333333333333334,1.5031151282481658,785.8
 there is no universal definition of which tovarked foremol as antiquities viscibures define varie or 100 years as antiquities ,det finns ingen universell definition av vilka tillverkade föremål som är antikviteter vissa skattebyråer definierar varor äldre än 100 år som antikviteter,0.9090909090909091,0.9827343234117482,782.5
 rurrir theup the two tora polberen formed them then to a ball with rean bluet hand ,rör ihop de två torra pulvren forma dem sedan till en boll med rena blöta händer,1.0,1.2158607719121155,788.1
 there can be more maria on the near ligand side after the scorpion is thunner there it did it easier for lava to the stig up to the yutan ,det kan finnas fler maria på närliggande sidan eftersom skorpan är tunnare där det gjorde det lättare för lava att stiga upp till ytan,1.125,1.2678213043299984,784.0
 if you will be near there there the hinder soccer must you come tidiit for to get a camping place near the musicen ,om du vill vara nära där det händer saker måste du komma tidigt för att få en campingplats nära musiken,1.15,0.9120255762392336,789.0
 even if aal is stark frippled with science fiction it is a much important gren in data wetenskapen that inbegripe machines bea tearned inlearning and intelligence ,även om ai är starkt förknippat med science fiction är det en mycket viktig gren inom datavetenskapen som inbegriper maskiners beteende inlärning och intelligens,0.9583333333333334,0.8025253331789406,784.5
 one of the most methods that are used for to illustrate the victim of socialization is to theat is to tit on the fuliuli the fulliuic or afti mishandle is not socialized of the wuxen under their sufficed not socialized by the wuxen under their sufficiency ,en av de vanligaste metoderna som används för att illustrera vikten av socialisering är att titta på de få olyckliga fallen av barn som genom försummelse olycka eller avsiktlig misshandel inte socialiserats av vuxna under sin uppväxt,1.2162162162162162,0.8062943892133831,771.3
 virtual team holds the same higher standards as conventional team but there are subtletyl team ,virtuella team håller samma samma höga standarder som konventionella team men det finns subtila skillnader,0.8666666666666667,1.0512085227699546,787.0
 grunned of the long sumakeration s vagueness could stilen in westermeller hyslap after 25 to 30 years ,på grund av de långsamma kommunikationsvägarna kunde stilarna i väst emellertid släpa efter med 25 till 30 år,0.8888888888888888,1.6451976209316612,785.3
 brotar colleg hillade also luna ,brottarkollegor hyllade också luna,1.0,1.8524244626363118,788.2
 as malsidigatigan tigran cletreren but not brimma hopp along stretcher and drow me five times circa an stark manniche ,som allsidig atlet kan tigern klättra men inte bra simma hoppa långa sträckor och dra med fem gånger styrkan hos en stark människa,0.9565217391304348,1.1275220335575573,788.6
 fru kirchner to china gave his intention to candidate to president on the argentinian theater same place where she started his campaign to senate in the year 2005 as a meadlem in the province delegation from buenos aires ,fru kirchner tillkännagav sin intention att kandidera till president på den argentinska teatern samma plats där hon startade sin kampanj till senaten år 2005 som medlem i provinsdelegationen från buenos aires,1.0,0.6683932410346137,782.8
 m s is a sukedom that to the central nerve system which bestore theirn rigmarine and synerven ,ms är en sjukdom som påverkar centrala nervsystemet vilket består av hjärnan ryggmärgen och synnerven,1.1333333333333333,0.92572605778985,779.8
