transcription,reference,wer,rtf,cpu
 som var allsidig atlet kan tiga en klättra men inte bra simma hoppa långa stäcker och dra med fem gånger så du kan nosa en stark människa ,som allsidig atlet kan tigern klättra men inte bra simma hoppa långa sträckor och dra med fem gånger styrkan hos en stark människa,0.34782608695652173,0.023671775533441915,417.4
 fru kirchner tillkännagav sin intention att kandidera till president på den argentinska teater samma plast där hon startade sin kampanj till senaten år 2005 som medlem i provinstelegationen från buenos aires ,fru kirchner tillkännagav sin intention att kandidera till president på den argentinska teatern samma plats där hon startade sin kampanj till senaten år 2005 som medlem i provinsdelegationen från buenos aires,0.0967741935483871,0.013962991876539842,359.3
 ms är en sjukdom som påverkar centrala nervsystemet vilket består av hjärnan riggmärgen och sinerven ,ms är en sjukdom som påverkar centrala nervsystemet vilket består av hjärnan ryggmärgen och synnerven,0.13333333333333333,0.014638245528471386,509.5
 barn placeras i fosterhem av många olika anledningar från varnvård till övergrepp och till med utpressning ,barn placeras i fosterhem av många olika anledningar från vanvård till övergrepp och till med utpressning,0.0625,0.018443065474789782,507.0
 även om detta ofta bara är en felaktig stereotyp är det bästa sätt att klara sig i paris och uppföra sig på bästa sätt och bete sig som någon som är en ben eleve väluppfostrad det kommer att göra det betydligt enklare att ta sig runt , även om detta ofta bara är en felaktig stereotyp är det bästa sättet att klara sig i paris fortfarande att uppföra sig på bästa sätt och bete sig som någon som är bien élevé väluppfostrad det kommer göra det betydligt enklare att ta sig runt ,0.15555555555555556,0.018865196265984534,326.6
 oliver sachs visade i sin skrift presidentens tal hur människor som inte kan förstå tal på grund av gärnskador ändå kan bedöma uppriktighet korrekt , oliver sacks visade i sin skrift presidentens tal hur människor som inte kan förstå tal på grund av hjärnskador ändå kan bedöma uppriktighet korrekt ,0.08333333333333333,0.015953915689128014,454.4
 det hävdas att den bästa placeringen för subjektet är där linerna som delar bilden i 3d delar vertikalt och korrisonellt möts se exemplet ,det hävdas att den bästa placeringen för subjektet är där linjerna som delar bilden i tredjedelar vertikalt och horisontellt möts se exemplet,0.18181818181818182,0.02203568921866992,374.5
 medan han arbetade på sjukhuset började liggins undersöka för tidiga födelsklar under sin fritid ,medan han arbetade på sjukhuset började liggins undersöka för tidiga födslar under sin fritid,0.07142857142857142,0.02489985719238971,477.1
 detta gör att den är bakåt kompatibel med 802 11a 802 11b och 802 11g förutsatt att basstationen har två radioapparater ,detta gör att den är bakåtkompatibel med 802 11a 802 11b och 802 11g förutsatt att basstationen har två radioapparater,0.1,0.009808705331754035,437.7
 stora områden längre norrut är mycket glesbefolkade och vissa är nära nog obebott vildmark ,stora områden längre norrut är mycket glest befolkade och vissa är nära nog obebodd vildmark,0.2,0.014753073684928952,559.5
 han har inte kunnat ta det medicin som behövs för att övervinna sin smärtad och det är förbjudna i tävlingen ,han har inte kunnat ta de mediciner som behövs för att övervinna sin smärta då de är förbjudna i tävlingen,0.25,0.0266955333685725,495.6
 själva får donet togs bort från olika platser när den klockan 12 00 samma dag ,själva fordonet togs bort från olycksplatsen runt klockan 12 00 samma dag,0.5,0.02025623579283018,473.2
 samma månad körde en annan trafikflygplan av en landningsbanen i marschadd och kolliderade med en vägg vilket ledde till 17 döda ,samma månad körde en annat trafikflygplan av en landningsbana i mashhad och kolliderade med en vägg vilket ledde till 17 döda,0.14285714285714285,0.015490458755896835,490.5
 legeringar är en blandning av två eller flera metaller kom ihåg att det finns många olika grundämnen i det periodiska systemet ,legeringar är en blandning av två eller flera metaller kom ihåg att det finns många olika grundämnen i det periodiska systemet,0.0,0.016525470548205905,457.8
 för springboks avslutade det en femmars så lång förlustserie ,för springboks avslutade det en fem matcher lång förlustserie,0.2222222222222222,0.023067756538533987,658.9
 det blir naturligtvis enklare för det är ett lärare deportligisisk om det redan kan ett romansk språk ,det blir naturligtvis enklare för dig att lära dig portugisiska om du redan kan ett romanskt språk,0.4117647058823529,0.019663351553457754,522.1
