transcription,reference,wer,rtf,cpu
 barn placeres in foster home of many different onledgown to overgrap and till with uppressing ,barn placeras i fosterhem av många olika anledningar från vanvård till övergrepp och till med utpressning,0.875,0.025417072227202263,359.8
 even if this often just a felacted stereotype it is the best way to clear in paris for forerunner to be able to be able to beckxed as someone who is bien eleve well uposted it will make it a bitid easier to take around , även om detta ofta bara är en felaktig stereotyp är det bästa sättet att klara sig i paris fortfarande att uppföra sig på bästa sätt och bete sig som någon som är bien élevé väluppfostrad det kommer göra det betydligt enklare att ta sig runt ,0.9777777777777777,0.02837550284257576,254.4
 oliver sacks viz in his script president s tal how people who not can forstow talk on the ground of gyrnskotor endo can bedem a up requiet correct, oliver sacks visade i sin skrift presidentens tal hur människor som inte kan förstå tal på grund av hjärnskador ändå kan bedöma uppriktighet korrekt ,1.0416666666666667,0.022734134686916364,348.8
 it is that the best placering for subjectet are the liners that deline that are vertical and horizontally met see example ,det hävdas att den bästa placeringen för subjektet är där linjerna som delar bilden i tredjedelar vertikalt och horisontellt möts se exemplet,1.0,0.021622536030221493,377.7
 while he had worked at the hospital began liggins to searcher for tidigal for tidigal under his fritit ,medan han arbetade på sjukhuset började liggins undersöka för tidiga födslar under sin fritid,1.1428571428571428,0.03936209921109474,344.9
 this does that it is back hot compatible with 802 11a 802 11b and 802 1g for a basestation for radioapparapparapparapparapparer i mean i m you know i m,detta gör att den är bakåtkompatibel med 802 11a 802 11b och 802 11g förutsatt att basstationen har två radioapparater,1.2,0.0297919700020238,211.2
 stora omroden longer north out is much glesbefolkated and some are nearer nog o bebot vild mark ,stora områden längre norrut är mycket glest befolkade och vissa är nära nog obebodd vildmark,1.0,0.021595063135605448,404.4
 he has not been to take the medicine that is through to overwinning his smartad and it is forbunner in the tetherling ,han har inte kunnat ta de mediciner som behövs för att övervinna sin smärta då de är förbjudna i tävlingen,1.1,0.03729192715770793,388.4
 sheldonet was from onlixplats around 12 00 same day ,själva fordonet togs bort från olycksplatsen runt klockan 12 00 samma dag,0.8333333333333334,0.02012029961422757,471.0
 samma morned chaired an other traffic flip plan of a landings bana in marchand and collidered with a way which led to seventeen dead,samma månad körde en annat trafikflygplan av en landningsbana i mashhad och kolliderade med en vägg vilket ledde till 17 döda,1.0952380952380953,0.01876013619559152,367.1
 leggeringar is a blend of two or flera metals come in that there are many different ground emmen in the periodical system ,legeringar är en blandning av två eller flera metaller kom ihåg att det finns många olika grundämnen i det periodiska systemet,1.0,0.023360571099652186,353.4
 for springbok so it was a five marser long for lust series ,för springboks avslutade det en fem matcher lång förlustserie,1.3333333333333333,0.03586949480606822,449.7
 it will naturally enkler for it to learn it in portuguese if you can a romansk you know ,det blir naturligtvis enklare för dig att lära dig portugisiska om du redan kan ett romanskt språk,1.0588235294117647,0.04409728226838289,291.4
